{
  "metadata": {
    "name": "single-site-core-lab",
    "displayName": "Single Site Core Lab",
    "description": "One primary DC and one member server for general AD testing.",
    "author": "",
    "created": "2026-03-08T14:20:00Z",
    "modified": "2026-03-08T14:20:00Z",
    "tags": [
      "ad",
      "core",
      "single-site"
    ]
  },
  "domain": {
    "fqdn": "lab.local",
    "netbiosName": "LAB",
    "functionalLevel": "Win2019",
    "safeModePassword": ""
  },
  "credentials": {
    "localAdminRef": "ealab-local-admin",
    "domainAdminRef": "ealab-domain-admin",
    "dsrmRef": "ealab-dsrm"
  },
  "guestDefaults": {
    "locale": "en-US",
    "timeZone": "UTC",
    "installTimeoutMinutes": 90,
    "postInstallTimeoutMinutes": 45,
    "defaultTools": [],
    "domainJoinOuPath": ""
  },
  "networks": [
    {
      "name": "LabInternal",
      "switchType": "Internal",
      "subnet": "192.168.10.0/24",
      "gateway": "192.168.10.1",
      "dnsServers": [
        "192.168.10.10"
      ]
    }
  ],
  "baseImages": {
    "windowsServer2019": {
      "isoPath": "E:\\ISOs\\17763.253.190108-0006.rs5_release_svc_refresh_SERVER_EVAL_x64FRE_en-us.iso",
      "productKey": ""
    },
    "windowsServer2022": {
      "isoPath": "E:\\ISOs\\20348.169.210806-2348.fe_release_svc_refresh_SERVER_EVAL_x64FRE_en-us.iso",
      "productKey": ""
    },
    "windowsClient": {
      "isoPath": "",
      "productKey": ""
    },
    "linux": {
      "isoPath": "",
      "distro": ""
    }
  },
  "vmDefinitions": [
    {
      "name": "DC01",
      "role": "DomainController",
      "roles": [
        "DomainController",
        "DNS"
      ],
      "os": "windowsServer2022",
      "generation": 2,
      "secureBoot": true,
      "tpmEnabled": false,
      "hardware": {
        "cpuCount": 2,
        "memoryMB": 4096,
        "diskSizeGB": 80
      },
      "network": "LabInternal",
      "staticIP": "192.168.10.10",
      "count": 1,
      "notes": "Primary domain controller.",
      "domainController": {
        "deploymentType": "newForest"
      },
      "orchestration": {
        "phaseTag": "dc-primary",
        "bootstrap": "winrm"
      },
      "guestConfiguration": {
        "computerName": "DC01",
        "locale": "en-US",
        "timeZone": "UTC",
        "network": {
          "ipAddress": "192.168.10.10",
          "subnetMask": "255.255.255.0",
          "gateway": "192.168.10.1",
          "dnsServers": [
            "192.168.10.10"
          ]
        },
        "domainJoin": {
          "enabled": false,
          "ouPath": "",
          "credentialRef": ""
        },
        "tools": [],
        "firstBootScript": ""
      }
    },
    {
      "name": "SRV01",
      "role": "MemberServer",
      "roles": [
        "MemberServer"
      ],
      "os": "windowsServer2022",
      "generation": 2,
      "secureBoot": true,
      "tpmEnabled": false,
      "hardware": {
        "cpuCount": 2,
        "memoryMB": 3072,
        "diskSizeGB": 80
      },
      "network": "LabInternal",
      "staticIP": "192.168.10.20",
      "count": 1,
      "notes": "General-purpose member server.",
      "orchestration": {
        "phaseTag": "member",
        "bootstrap": "winrm"
      },
      "guestConfiguration": {
        "computerName": "SRV01",
        "locale": "en-US",
        "timeZone": "UTC",
        "network": {
          "ipAddress": "192.168.10.20",
          "subnetMask": "255.255.255.0",
          "gateway": "192.168.10.1",
          "dnsServers": [
            "192.168.10.10"
          ]
        },
        "domainJoin": {
          "enabled": true,
          "ouPath": "",
          "credentialRef": "ealab-domain-admin"
        },
        "tools": [
          "RSAT-AD-Tools"
        ],
        "firstBootScript": ""
      }
    }
  ],
  "globalHardwareDefaults": {
    "cpuCount": 2,
    "memoryMB": 2048,
    "diskSizeGB": 60
  },
  "storage": {
    "vmRootPath": "E:\\EALabs",
    "logsPath": "E:\\EALabs\\Logs"
  },
  "orchestration": {
    "engine": "hybrid",
    "controller": "shared",
    "postProvisionEnabled": true,
    "playbookProfile": "default-ad",
    "inventoryStrategy": "per-lab",
    "skipOrchestration": false
  }
}
